{
  "$ref": "#/definitions/soundtrack",
  "definitions": {
    "soundtrack": {
      "type": "object",
      "properties": {
        "title": {
          "type": "string"
        },
        "vibe": {
          "type": "string"
        },
        "description": {
          "type": "string"
        },
        "spotifyId": {
          "type": "string"
        },
        "chapter": {
          "type": "number"
        },
        "$schema": {
          "type": "string"
        }
      },
      "required": [
        "title",
        "vibe",
        "description",
        "spotifyId",
        "chapter"
      ],
      "additionalProperties": false
    }
  },
  "$schema": "http://json-schema.org/draft-07/schema#"
}