{
    "title": "Københavnsk Sommer",
    "vibe": "Urban Livlighed",
    "description": "Lyse, opløftende akustiske guitarer og pulserende elektroniske rytmer, der fanger det lange lys fra en dansk sommeraften. Bedst parret med en gåtur eller kreativ brainstorming.",
    "spotifyId": "37i9dQZF1DX8Ueb99Mh3jX",
    "chapter": 3
}
