{
    "title": "The Deep Work Stack",
    "vibe": "Cognitive Focus",
    "description": "A collection of architectural textures and low-frequency rhythms designed to narrow your focus to a single point of intention. Best used for complex data modeling or deep analytical writing.",
    "spotifyId": "37i9dQZF1DX8Ueb99Mh3jX",
    "chapter": 1
}
