{
    "title": "Den Dybe Koncentration",
    "vibe": "Kognitivt Fokus",
    "description": "En samling af arkitektoniske teksturer og lavfrekvente rytmer designet til at indsnævre dit fokus til ét punkt af intention. Bruges bedst til kompleks datamodellering eller dyb analytisk skrivning.",
    "spotifyId": "37i9dQZF1DX8Ueb99Mh3jX",
    "chapter": 1
}
