{
    "title": "Nordisk Vinters Melankoli",
    "vibe": "Reflekterende Ensomhed",
    "description": "Kolde klaverteksturer og ambiente lydflader, der spejler de lange danske vintre. Ideel til at se tilbage på årets fremskridt eller finde ro i de stille timer.",
    "spotifyId": "37i9dQZF1DX4sWsp6KmGjH",
    "chapter": 2
}
